{
  "schema_version": "1.0",
  "task_type": "video.explain.v1",
  "task_id": "task-fixture-formula",
  "source": {"note_id": "note-l1", "note_revision": 1, "title": "L1 收敛课堂笔记", "language": "zh-CN", "entrypoint": "input/content.md", "bundle_sha256": "d32c6fc92224eeb81ca2763c695173b95aa6860601f1d193a7d4610fd2376fc3"},
  "brief": {"audience": "学习实分析的本科生", "learning_goal": "理解 L1 收敛的定义和整体误差面积直觉", "prerequisites": ["积分", "函数列"], "target_duration_sec": 42, "aspect_ratio": "9:16", "style_preset": "clean-academic", "user_instructions": "公式逐步出现，强调绝对值避免误差抵消"},
  "research": {"external_research": false},
  "review": {"storyboard_required": true},
  "voice": {"profile": "default-zh", "speed": 1.0}
}
